{"source_tif":"/home/lachlan/ProjectsLFS/Zhengyu/DEO/App80 DEO/10uM/05-十二月-2025/10x00.tif","source_png":"/home/lachlan/ProjectsLFS/Zhengyu/DEO-PNG/App80 DEO/10uM/05-十二月-2025/10x00.png","experiment_id":"App80 DEO","concentration_label":"10uM","concentration_value_uM":10,"date_label":"05-十二月-2025","magnification_token":"10x","sample_token":"00","image_summary":{"droplet_count_clear":1,"droplet_count_including_partials":1,"note":"One dominant, near-circular droplet is fully visible and centered in the frame; internal structures are organoid content rather than separate droplets."},"droplets":[{"droplet_id":1,"center_x_px":1375.0,"center_y_px":1030.0,"radius_px":875.0,"is_partial":false,"completeness":true,"position_label":"center","confidence":0.95,"initial_organoid_count_estimate":120,"initial_fusion_level_0_to_5":4.3,"note":"Primary DEO droplet boundary is visible as a continuous circular rim; substantial internal aggregation/fusion with several large fused organoid masses."}]}