{"source_tif":"/home/lachlan/ProjectsLFS/Zhengyu/DEO/App80 DEO/10uM/05-十二月-2025/10x02.tif","source_png":"/home/lachlan/ProjectsLFS/Zhengyu/DEO-PNG/App80 DEO/10uM/05-十二月-2025/10x02.png","experiment_id":"App80 DEO","concentration_label":"10uM","concentration_value_uM":10,"date_label":"05-十二月-2025","magnification_token":"10x","sample_token":"02","image_summary":{"droplet_count_clear":0,"droplet_count_including_partials":2,"note":"One dominant droplet occupies most of the field but is clipped by frame boundaries; one additional small, unique edge-right partial droplet is visible near the top-right border."},"droplets":[{"droplet_id":1,"center_x_px":1360,"center_y_px":1035,"radius_px":860,"is_partial":true,"completeness":false,"position_label":"center","confidence":0.87,"initial_organoid_count_estimate":35,"initial_fusion_level_0_to_5":4.2,"note":"Primary DEO droplet; boundary arc is clear on left/right with top and bottom clipped. Contains many organoid structures and several fused clusters."},{"droplet_id":2,"center_x_px":2783,"center_y_px":174,"radius_px":76,"is_partial":true,"completeness":false,"position_label":"edge-right","confidence":0.58,"initial_organoid_count_estimate":2,"initial_fusion_level_0_to_5":1,"note":"Small partial droplet segment at top-right image edge; only a portion is visible, kept as a unique non-duplicate edge droplet."}]}