{"source_tif":"/home/lachlan/ProjectsLFS/Zhengyu/DEO/App80 DEO/10uM/05-十二月-2025/10x01.tif","source_png":"/home/lachlan/ProjectsLFS/Zhengyu/DEO-PNG/App80 DEO/10uM/05-十二月-2025/10x01.png","experiment_id":"App80 DEO","concentration_label":"10uM","concentration_value_uM":10,"date_label":"05-十二月-2025","magnification_token":"10x","sample_token":"01","image_summary":{"droplet_count_clear":1,"droplet_count_including_partials":3,"note":"One dominant central droplet is clearly visible and analyzable. Two additional unique edge-partial droplets are visible at the top-right and bottom-right margins; both are included conservatively with lower confidence for biological content estimates due to truncation."},"droplets":[{"droplet_id":1,"center_x_px":1406.43,"center_y_px":1006.27,"radius_px":593.56,"is_partial":false,"completeness":true,"position_label":"center","confidence":0.97,"initial_organoid_count_estimate":55,"initial_fusion_level_0_to_5":4,"note":"Primary full droplet; boundary is largely complete and internal organoid/clump content is dense with multiple fused regions."},{"droplet_id":2,"center_x_px":2588.2,"center_y_px":224.55,"radius_px":247.43,"is_partial":true,"completeness":false,"position_label":"top-right","confidence":0.88,"initial_organoid_count_estimate":8,"initial_fusion_level_0_to_5":3,"note":"Distinct partial droplet entering from top-right; interpretable arc with visible internal material but limited field coverage."},{"droplet_id":3,"center_x_px":2605.0,"center_y_px":2145.0,"radius_px":255.0,"is_partial":true,"completeness":false,"position_label":"edge-bottom","confidence":0.62,"initial_organoid_count_estimate":5,"initial_fusion_level_0_to_5":3,"note":"Large droplet arc at bottom-right edge; center lies outside frame, so organoid/fusion estimates are low-confidence."}]}