{"source_tif":"/home/lachlan/ProjectsLFS/Zhengyu/DEO/App80 DEO/10uM/05-十二月-2025/4x01.tif","source_png":"/home/lachlan/ProjectsLFS/Zhengyu/DEO-PNG/App80 DEO/10uM/05-十二月-2025/4x01.png","experiment_id":"App80 DEO","concentration_label":"10uM","concentration_value_uM":10,"date_label":"05-十二月-2025","magnification_token":"4x","sample_token":"01","image_summary":{"droplet_count_clear":3,"droplet_count_including_partials":5,"note":"Three droplets are fully visible and suitable for confident droplet-level analysis (mid-left, mid-right, bottom-center). Two additional unique edge-partial droplets are present at the top-right and top-left edges. No duplicate partials retained."},"droplets":[{"droplet_id":1,"center_x_px":542.5,"center_y_px":740.9,"radius_px":291.6,"is_partial":false,"completeness":true,"position_label":"mid-left","confidence":0.95,"initial_organoid_count_estimate":65,"initial_fusion_level_0_to_5":4.5,"note":"Well-defined circular boundary; dense internal aggregates with multiple fused clusters."},{"droplet_id":2,"center_x_px":2279.6,"center_y_px":945.9,"radius_px":290.5,"is_partial":false,"completeness":true,"position_label":"mid-right","confidence":0.93,"initial_organoid_count_estimate":55,"initial_fusion_level_0_to_5":3.2,"note":"Clear droplet outline; moderate-to-high internal organoid load with mixed cluster sizes."},{"droplet_id":3,"center_x_px":1637.2,"center_y_px":1557.3,"radius_px":264.6,"is_partial":false,"completeness":true,"position_label":"bottom-center","confidence":0.92,"initial_organoid_count_estimate":70,"initial_fusion_level_0_to_5":3.8,"note":"Fully visible droplet; many small structures plus several darker fused regions."},{"droplet_id":4,"center_x_px":2220.3,"center_y_px":234.5,"radius_px":437.7,"is_partial":true,"completeness":false,"position_label":"top-right","confidence":0.8,"initial_organoid_count_estimate":45,"initial_fusion_level_0_to_5":4,"note":"Large droplet truncated by top edge; lower portion visible with dense clustered content."},{"droplet_id":5,"center_x_px":206.6,"center_y_px":49.7,"radius_px":120.5,"is_partial":true,"completeness":false,"position_label":"edge-left","confidence":0.62,"initial_organoid_count_estimate":20,"initial_fusion_level_0_to_5":2.5,"note":"Small corner partial at top-left/left edge with limited visible interior; approximate circle fit."}]}