{"source_tif":"/home/lachlan/ProjectsLFS/Zhengyu/DEO/App80 DEO/10uM/05-十二月-2025/4x00.tif","source_png":"/home/lachlan/ProjectsLFS/Zhengyu/DEO-PNG/App80 DEO/10uM/05-十二月-2025/4x00.png","experiment_id":"App80 DEO","concentration_label":"10uM","concentration_value_uM":10,"date_label":"05-十二月-2025","magnification_token":"4x","sample_token":"00","image_summary":{"droplet_count_clear":6,"droplet_count_including_partials":9,"note":"Six droplets are fully interpretable; three additional edge droplets are included as unique partials (top and right/left borders). Circle priors were de-duplicated and reduced to visually consistent droplets."},"droplets":[{"droplet_id":1,"center_x_px":1541,"center_y_px":180,"radius_px":230,"is_partial":true,"completeness":false,"position_label":"edge-top","confidence":0.9,"initial_organoid_count_estimate":18,"initial_fusion_level_0_to_5":4.0,"note":"Top-edge partial droplet; only lower portion visible."},{"droplet_id":2,"center_x_px":2330,"center_y_px":606,"radius_px":350,"is_partial":false,"completeness":true,"position_label":"top-right","confidence":0.96,"initial_organoid_count_estimate":45,"initial_fusion_level_0_to_5":5.0,"note":"Large dense droplet with extensive fused dark clusters."},{"droplet_id":3,"center_x_px":1074,"center_y_px":820,"radius_px":275,"is_partial":false,"completeness":true,"position_label":"center","confidence":0.95,"initial_organoid_count_estimate":30,"initial_fusion_level_0_to_5":4.0,"note":"Well-defined droplet; multiple medium-large aggregates with moderate fusion."},{"droplet_id":4,"center_x_px":1260,"center_y_px":1570,"radius_px":266,"is_partial":false,"completeness":true,"position_label":"bottom-center","confidence":0.94,"initial_organoid_count_estimate":28,"initial_fusion_level_0_to_5":3.5,"note":"Moderately populated droplet with mixed single and clustered organoids."},{"droplet_id":5,"center_x_px":2062,"center_y_px":1511,"radius_px":297,"is_partial":false,"completeness":true,"position_label":"bottom-right","confidence":0.95,"initial_organoid_count_estimate":32,"initial_fusion_level_0_to_5":4.0,"note":"High-content droplet with several fused regions and bright rims."},{"droplet_id":6,"center_x_px":620,"center_y_px":1775,"radius_px":300,"is_partial":false,"completeness":true,"position_label":"bottom-left","confidence":0.74,"initial_organoid_count_estimate":6,"initial_fusion_level_0_to_5":1.0,"note":"Mostly sparse droplet with low apparent organoid burden; boundary is faint but closed."},{"droplet_id":7,"center_x_px":-130,"center_y_px":1020,"radius_px":280,"is_partial":true,"completeness":false,"position_label":"edge-left","confidence":0.63,"initial_organoid_count_estimate":10,"initial_fusion_level_0_to_5":2.0,"note":"Left-edge partial arc; included as unique interpretable droplet."},{"droplet_id":8,"center_x_px":2833,"center_y_px":966,"radius_px":110,"is_partial":true,"completeness":false,"position_label":"edge-right","confidence":0.66,"initial_organoid_count_estimate":8,"initial_fusion_level_0_to_5":2.5,"note":"Small right-edge partial droplet; distinct from lower-right partial."},{"droplet_id":9,"center_x_px":2748,"center_y_px":1740,"radius_px":212,"is_partial":true,"completeness":false,"position_label":"edge-right","confidence":0.78,"initial_organoid_count_estimate":12,"initial_fusion_level_0_to_5":3.0,"note":"Lower-right partial droplet with visible internal particulate content."}]}